filename,interaction_number,speaker,sentence_number,text,task_type,Initials,Birth month,Birth Year,Mother tongue,Sex,Date of experiment,Experimenter,Place experiment,Age at experiment,Condition,Language of experiment,Order of tasks,Appreciation,text_en
PAIK_VB_bot.docx,10,ChatGPT,2,ChatGPT regarde cette phrase et se demande : quels mots viennent souvent après ça ?,Information,VB,5,2015,french,m,4/19/2025,Olga,Touquet,9.98,T,French,LC,3,Chatgpt looks at this sentence and wonders: what words often come after that?
PAIK_VB_bot.docx,10,ChatGPT,3,"Peut-être “un manteau”, ou “une écharpe”.",Information,VB,5,2015,french,m,4/19/2025,Olga,Touquet,9.98,T,French,LC,3,"Maybe “a coat”, or “a scarf”."
PAIK_VB_bot.docx,10,ChatGPT,4,"Il ne comprend pas le froid comme toi, mais il a vu plein de phrases où des gens parlent du froid, alors il devine ce qui vient ensuite.",Information,VB,5,2015,french,m,4/19/2025,Olga,Touquet,9.98,T,French,LC,3,"He does not understand the cold like you, but he saw lots of sentences where people talk about the cold, so he guess what comes next."
PAIK_VB_bot.docx,10,ChatGPT,5,"C’est un peu comme un jeu de devinettes très rapide, basé sur tout ce qu’il a lu avant.",Information,VB,5,2015,french,m,4/19/2025,Olga,Touquet,9.98,T,French,LC,3,"It's a bit like a very fast game of riddles, based on everything he read before."
PAIK_VB_bot.docx,10,ChatGPT,6,Est-ce que cet exemple t’aide à mieux comprendre ?,Information,VB,5,2015,french,m,4/19/2025,Olga,Touquet,9.98,T,French,LC,3,Did this example help you better understand?
PAIK_VB_bot.docx,10,ChatGPT,7,ChatGPT can make mistakes.,Information,VB,5,2015,french,m,4/19/2025,Olga,Touquet,9.98,T,French,LC,3,ChatGPT can make mistakes.
PAIK_VB_bot.docx,10,ChatGPT,8,Check important info.,Information,VB,5,2015,french,m,4/19/2025,Olga,Touquet,9.98,T,French,LC,3,Check important info.
PAIK_VB_bot.docx,10,ChatGPT,9,Part 3,Information,VB,5,2015,french,m,4/19/2025,Olga,Touquet,9.98,T,French,LC,3,Part 3
PAIK_VB_bot.docx,11,You,1,Peux-tu m'aider à comprendre ce que c'est le cycle des données ?,Information,VB,5,2015,french,m,4/19/2025,Olga,Touquet,9.98,T,French,LC,3,Can you help me understand what the data cycle is?
PAIK_VB_bot.docx,11,ChatGPT,1,Bien sûr.,Information,VB,5,2015,french,m,4/19/2025,Olga,Touquet,9.98,T,French,LC,3,Of course.
PAIK_VB_bot.docx,11,ChatGPT,2,"Le cycle des données, c’est une façon de décrire comment les données sont utilisées, du début à la fin.",Information,VB,5,2015,french,m,4/19/2025,Olga,Touquet,9.98,T,French,LC,3,"The data cycle is a way to describe how the data is used, from start to finish."
PAIK_VB_bot.docx,11,ChatGPT,3,"D’abord, on collecte les données, par exemple en faisant une enquête ou en utilisant des capteurs.",Information,VB,5,2015,french,m,4/19/2025,Olga,Touquet,9.98,T,French,LC,3,"First, we collect data, for example by investigating or using sensors."
PAIK_VB_bot.docx,11,ChatGPT,4,"Ensuite, on les organise pour mieux les comprendre.",Information,VB,5,2015,french,m,4/19/2025,Olga,Touquet,9.98,T,French,LC,3,Then we organize them to better understand them.
PAIK_VB_bot.docx,11,ChatGPT,5,"Après ça, on les analyse pour trouver des idées ou des réponses.",Information,VB,5,2015,french,m,4/19/2025,Olga,Touquet,9.98,T,French,LC,3,"After that, we analyze them to find ideas or answers."
PAIK_VB_bot.docx,11,ChatGPT,6,"Puis, on partage les résultats, comme dans un rapport.",Information,VB,5,2015,french,m,4/19/2025,Olga,Touquet,9.98,T,French,LC,3,"Then, we share the results, as in a report."
PAIK_VB_bot.docx,11,ChatGPT,7,"Enfin, parfois, on stocke les données ou on les supprime si on n’en a plus besoin.",Information,VB,5,2015,french,m,4/19/2025,Olga,Touquet,9.98,T,French,LC,3,"Finally, sometimes we store the data or delete it if we no longer need them."
PAIK_VB_bot.docx,11,ChatGPT,8,Est-ce qu’un de ces moments du cycle t’intéresse plus que les autres ?,Information,VB,5,2015,french,m,4/19/2025,Olga,Touquet,9.98,T,French,LC,3,Does one of those moments in the cycle interest you more than the others?
PAIK_VB_bot.docx,12,You,1,Merci d'avoir regardé cette vidéo !,Information,VB,5,2015,french,m,4/19/2025,Olga,Touquet,9.98,T,French,LC,3,Thank you for watching this video!
PAIK_VB_bot.docx,12,ChatGPT,1,C’est très gentil de le dire !,Information,VB,5,2015,french,m,4/19/2025,Olga,Touquet,9.98,T,French,LC,3,It’s very nice to say!
PAIK_VB_bot.docx,12,ChatGPT,2,"Si tu faisais une vidéo toi-même, sur le cycle des données par exemple, qu’est-ce que tu y mettrais ?",Information,VB,5,2015,french,m,4/19/2025,Olga,Touquet,9.98,T,French,LC,3,"If you made a video yourself, on the data cycle for example, what will you put in it?"
PAIK_VB_bot.docx,12,ChatGPT,3,________________________________,Information,VB,5,2015,french,m,4/19/2025,Olga,Touquet,9.98,T,French,LC,3,
PAIK_VB_bot.docx,13,You,1,Est-ce que tu peux aider à comprendre ce que c'est le cycle de l'eau?,Information,VB,5,2015,french,m,4/19/2025,Olga,Touquet,9.98,T,French,LC,3,Can you help understand what the water cycle is?
PAIK_VB_bot.docx,13,ChatGPT,1,Bien sûr.,Information,VB,5,2015,french,m,4/19/2025,Olga,Touquet,9.98,T,French,LC,3,Of course.
PAIK_VB_bot.docx,13,ChatGPT,2,"Le cycle de l’eau, c’est un mouvement qui ne s’arrête jamais, où l’eau change de place et de forme.",Information,VB,5,2015,french,m,4/19/2025,Olga,Touquet,9.98,T,French,LC,3,"The water cycle is a movement that never stops, where water changes space and shape."
PAIK_VB_bot.docx,13,ChatGPT,3,"D’abord, l’eau des océans, des rivières ou des lacs s’évapore à cause de la chaleur du soleil.",Information,VB,5,2015,french,m,4/19/2025,Olga,Touquet,9.98,T,French,LC,3,"First, the water of the oceans, rivers or lakes evaporates because of the heat of the sun."
PAIK_VB_bot.docx,13,ChatGPT,4,"Elle devient alors de la vapeur d’eau, un gaz invisible.",Information,VB,5,2015,french,m,4/19/2025,Olga,Touquet,9.98,T,French,LC,3,"It then becomes water vapor, an invisible gas."
PAIK_VB_bot.docx,13,ChatGPT,5,"Cette vapeur monte dans le ciel, où il fait plus froid, et elle se transforme en minuscules gouttelettes.",Information,VB,5,2015,french,m,4/19/2025,Olga,Touquet,9.98,T,French,LC,3,"This vapor goes up in the sky, where it is colder, and it turns into tiny droplets."
PAIK_VB_bot.docx,13,ChatGPT,6,"C’est la condensation, qui forme les nuages.",Information,VB,5,2015,french,m,4/19/2025,Olga,Touquet,9.98,T,French,LC,3,"It is condensation, which forms the clouds."
PAIK_VB_bot.docx,13,ChatGPT,7,"Quand les nuages deviennent trop pleins, l’eau retombe sous forme de pluie, de neige ou de grêle.",Information,VB,5,2015,french,m,4/19/2025,Olga,Touquet,9.98,T,French,LC,3,"When the clouds become too full, water falls in the form of rain, snow or hail."
PAIK_VB_bot.docx,13,ChatGPT,8,C’est ce qu’on appelle les précipitations.,Information,VB,5,2015,french,m,4/19/2025,Olga,Touquet,9.98,T,French,LC,3,This is called precipitation.
PAIK_VB_bot.docx,13,ChatGPT,9,"Ensuite, l’eau retourne dans les rivières, les lacs ou s’infiltre dans le sol.",Information,VB,5,2015,french,m,4/19/2025,Olga,Touquet,9.98,T,French,LC,3,"Then the water returns to the rivers, the lakes or infiltrates the ground."
PAIK_VB_bot.docx,13,ChatGPT,10,"Et puis, tout recommence.",Information,VB,5,2015,french,m,4/19/2025,Olga,Touquet,9.98,T,French,LC,3,"And then, everything starts again."
PAIK_VB_bot.docx,13,ChatGPT,11,Est-ce qu’il y a une partie que tu aimerais que j’explique plus lentement ?,Information,VB,5,2015,french,m,4/19/2025,Olga,Touquet,9.98,T,French,LC,3,Is there a part that you would like me to explain more slowly?
PAIK_VB_bot.docx,14,You,1,"Um, no.",Information,VB,5,2015,french,m,4/19/2025,Olga,Touquet,9.98,T,French,LC,3,"One, no."
PAIK_VB_bot.docx,14,ChatGPT,1,D’accord.,Information,VB,5,2015,french,m,4/19/2025,Olga,Touquet,9.98,T,French,LC,3,All right.
PAIK_VB_bot.docx,14,ChatGPT,2,"Quand tu dis “um, no,” est-ce que tu voulais dire que tout était clair pour toi ?",Information,VB,5,2015,french,m,4/19/2025,Olga,Touquet,9.98,T,French,LC,3,"When you say “Um, no,” Did you mean that everything was clear for you?"
PAIK_VB_bot.docx,14,ChatGPT,3,"C’est très bien de le dire comme ça : “Non merci, c’est clair.” Tu aimerais parler d’autre chose à présent ?",Information,VB,5,2015,french,m,4/19/2025,Olga,Touquet,9.98,T,French,LC,3,"It’s very good to say it like that: “No thanks, it’s clear.” Would you like to talk about something else now?"
PAIK_VB_bot.docx,15,You,1,Merci.,Information,VB,5,2015,french,m,4/19/2025,Olga,Touquet,9.98,T,French,LC,3,Merci.
PAIK_VB_bot.docx,15,You,2,Tu veux qu'il te teste pour que tu aies compris ?,Information,VB,5,2015,french,m,4/19/2025,Olga,Touquet,9.98,T,French,LC,3,Do you want him to test you so that you understand?
PAIK_VB_bot.docx,15,You,3,Oui.,Information,VB,5,2015,french,m,4/19/2025,Olga,Touquet,9.98,T,French,LC,3,Oui.
PAIK_VB_bot.docx,15,You,4,Tu peux lui demander ça.,Information,VB,5,2015,french,m,4/19/2025,Olga,Touquet,9.98,T,French,LC,3,You can ask him.
PAIK_VB_bot.docx,15,You,5,Peux-tu me tester ?,Information,VB,5,2015,french,m,4/19/2025,Olga,Touquet,9.98,T,French,LC,3,Can you test me?
PAIK_VB_bot.docx,15,You,6,Si j'ai compris.,Information,VB,5,2015,french,m,4/19/2025,Olga,Touquet,9.98,T,French,LC,3,If I understood.
PAIK_VB_bot.docx,15,ChatGPT,1,Bien sûr.,Information,VB,5,2015,french,m,4/19/2025,Olga,Touquet,9.98,T,French,LC,3,Of course.
PAIK_VB_bot.docx,15,ChatGPT,2,Tu peux dire gentiment : “Peux-tu me poser une question pour voir si j’ai bien compris le cycle de l’eau ?” C’est une manière polie de demander.,Information,VB,5,2015,french,m,4/19/2025,Olga,Touquet,9.98,T,French,LC,3,"You can say kindly: ""Can you ask me a question to see if I understood the water cycle?"" It’s a polite way to ask."
PAIK_VB_bot.docx,15,ChatGPT,3,"Alors, voici une question pour toi :
Quand l’eau s’évapore, où va-t-elle et que devient-elle ?",Information,VB,5,2015,french,m,4/19/2025,Olga,Touquet,9.98,T,French,LC,3,"So here's a question for you:
When the water evaporates, where does it go and what becomes?"
PAIK_VB_bot.docx,15,ChatGPT,4,Prends ton temps.,Information,VB,5,2015,french,m,4/19/2025,Olga,Touquet,9.98,T,French,LC,3,Take your time.
PAIK_VB_bot.docx,15,ChatGPT,5,Je t’écoute quand tu es prêt ou prête.,Information,VB,5,2015,french,m,4/19/2025,Olga,Touquet,9.98,T,French,LC,3,I listen to you when you are ready or ready.
PAIK_VB_bot.docx,16,You,1,Je pense être semée dans les nuages.,Information,VB,5,2015,french,m,4/19/2025,Olga,Touquet,9.98,T,French,LC,3,I think I am sown in the clouds.
PAIK_VB_bot.docx,16,ChatGPT,1,"Ah, tu veux peut-être dire que l’eau ""se met dans les nuages"", n’est-ce pas ?",Information,VB,5,2015,french,m,4/19/2025,Olga,Touquet,9.98,T,French,LC,3,"Ah, you may mean that the water ""gets into the clouds"", right?"
PAIK_VB_bot.docx,16,ChatGPT,2,C’est une jolie façon de le dire.,Information,VB,5,2015,french,m,4/19/2025,Olga,Touquet,9.98,T,French,LC,3,It's a nice way to say it.
PAIK_VB_bot.docx,16,ChatGPT,3,"On peut reformuler ça ainsi : “L’eau s’évapore et va dans le ciel, où elle devient des nuages grâce à la condensation.”",Information,VB,5,2015,french,m,4/19/2025,Olga,Touquet,9.98,T,French,LC,3,"We can reformulate this as well: ""The water evaporates and goes into the sky, where it becomes clouds thanks to condensation."""
PAIK_VB_bot.docx,16,ChatGPT,4,Tu es sur la bonne voie.,Information,VB,5,2015,french,m,4/19/2025,Olga,Touquet,9.98,T,French,LC,3,You are on the right track.
PAIK_VB_bot.docx,16,ChatGPT,5,Tu veux que je t’en pose une autre ?,Information,VB,5,2015,french,m,4/19/2025,Olga,Touquet,9.98,T,French,LC,3,Do you want me to ask you another?
PAIK_VB_bot.docx,17,You,1,Je pense que tu veux recommencer ?,Information,VB,5,2015,french,m,4/19/2025,Olga,Touquet,9.98,T,French,LC,3,I think you want to start again?
PAIK_VB_bot.docx,17,You,2,Oui.,Information,VB,5,2015,french,m,4/19/2025,Olga,Touquet,9.98,T,French,LC,3,Oui.
PAIK_VB_bot.docx,17,You,3,Ok.,Information,VB,5,2015,french,m,4/19/2025,Olga,Touquet,9.98,T,French,LC,3,Ok.
PAIK_VB_bot.docx,17,You,4,"Tu pourrais essayer de lui parler, on va voir si ça marche.",Information,VB,5,2015,french,m,4/19/2025,Olga,Touquet,9.98,T,French,LC,3,"You could try to talk to him, we're going to see if it works."
PAIK_VB_bot.docx,17,ChatGPT,1,"D’accord, je vais te poser une autre question, doucement.",Information,VB,5,2015,french,m,4/19/2025,Olga,Touquet,9.98,T,French,LC,3,"Okay, I'm going to ask you another question, slowly."
PAIK_VB_bot.docx,17,ChatGPT,2,"Quand les nuages sont trop remplis d’eau, que se passe-t-il ?",Information,VB,5,2015,french,m,4/19/2025,Olga,Touquet,9.98,T,French,LC,3,"When the clouds are too filled with water, what's going on?"
PAIK_VB_bot.docx,17,ChatGPT,3,Et comment appelle-t-on ce moment où l’eau tombe du ciel ?,Information,VB,5,2015,french,m,4/19/2025,Olga,Touquet,9.98,T,French,LC,3,And what do you call this moment when water falls from the sky?
PAIK_VB_bot.docx,17,ChatGPT,4,Tu peux répondre quand tu veux.,Information,VB,5,2015,french,m,4/19/2025,Olga,Touquet,9.98,T,French,LC,3,You can answer when you want.
PAIK_VB_bot.docx,17,ChatGPT,5,Je suis prête à écouter.,Information,VB,5,2015,french,m,4/19/2025,Olga,Touquet,9.98,T,French,LC,3,I am ready to listen.
PAIK_VB_bot.docx,18,You,1,Les vaporisations.,Information,VB,5,2015,french,m,4/19/2025,Olga,Touquet,9.98,T,French,LC,3,Vaporizations.
PAIK_VB_bot.docx,18,ChatGPT,1,"Tu as bien essayé, et c’est un mot qui ressemble à “évaporation”.",Information,VB,5,2015,french,m,4/19/2025,Olga,Touquet,9.98,T,French,LC,3,"You tried well, and it's a word that looks like ""evaporation""."
PAIK_VB_bot.docx,18,ChatGPT,2,"Mais ici, quand l’eau tombe des nuages, on appelle cela les précipitations.",Information,VB,5,2015,french,m,4/19/2025,Olga,Touquet,9.98,T,French,LC,3,"But here, when the water falls from the clouds, it is called precipitation."
PAIK_VB_bot.docx,18,ChatGPT,3,"Cela peut être de la pluie, de la neige, ou même de la grêle.",Information,VB,5,2015,french,m,4/19/2025,Olga,Touquet,9.98,T,French,LC,3,"It can be rain, snow, or even hail."
PAIK_VB_bot.docx,18,ChatGPT,4,C’est normal de se tromper parfois.,Information,VB,5,2015,french,m,4/19/2025,Olga,Touquet,9.98,T,French,LC,3,It’s normal to be mistaken sometimes.
PAIK_VB_bot.docx,18,ChatGPT,5,"Voulais-tu que je répète les étapes du cycle une nouvelle fois, tout doucement ?",Information,VB,5,2015,french,m,4/19/2025,Olga,Touquet,9.98,T,French,LC,3,"Did you want me to repeat the steps of the cycle again, very slowly?"
PAIK_VB_bot.docx,19,You,1,J'aime bien.,Information,VB,5,2015,french,m,4/19/2025,Olga,Touquet,9.98,T,French,LC,3,I like it.
PAIK_VB_bot.docx,19,ChatGPT,1,C’est très gentil de le dire.,Information,VB,5,2015,french,m,4/19/2025,Olga,Touquet,9.98,T,French,LC,3,It’s very nice to say.
PAIK_VB_bot.docx,19,ChatGPT,2,Merci beaucoup.,Information,VB,5,2015,french,m,4/19/2025,Olga,Touquet,9.98,T,French,LC,3,Thank you so much.
PAIK_VB_bot.docx,19,ChatGPT,3,"Alors, reprenons doucement le cycle de l’eau.",Information,VB,5,2015,french,m,4/19/2025,Olga,Touquet,9.98,T,French,LC,3,So let's take the water cycle slowly.
PAIK_VB_bot.docx,19,ChatGPT,4,"D’abord, le soleil chauffe l’eau des rivières, des lacs ou des mers.",Information,VB,5,2015,french,m,4/19/2025,Olga,Touquet,9.98,T,French,LC,3,"First, the sun heats water from rivers, lakes or seas."
PAIK_VB_bot.docx,19,ChatGPT,5,"L’eau s’évapore, c’est-à-dire qu’elle devient de la vapeur, un gaz invisible.",Information,VB,5,2015,french,m,4/19/2025,Olga,Touquet,9.98,T,French,LC,3,"The water evaporates, that is to say that it becomes steam, an invisible gas."
PAIK_VB_bot.docx,19,ChatGPT,6,"Ensuite, cette vapeur monte dans le ciel, où il fait plus froid.",Information,VB,5,2015,french,m,4/19/2025,Olga,Touquet,9.98,T,French,LC,3,"Then, this vapor goes up in the sky, where it is colder."
PAIK_VB_bot.docx,19,ChatGPT,7,Elle se transforme alors en petites gouttes d’eau : c’est la condensation.,Information,VB,5,2015,french,m,4/19/2025,Olga,Touquet,9.98,T,French,LC,3,It then turns into small drops of water: it is condensation.
PAIK_VB_bot.docx,19,ChatGPT,8,Ces gouttes forment les nuages.,Information,VB,5,2015,french,m,4/19/2025,Olga,Touquet,9.98,T,French,LC,3,These drops form the clouds.
PAIK_VB_bot.docx,19,ChatGPT,9,"Quand les nuages sont trop pleins, l’eau retombe : c’est ce qu’on appelle les précipitations.",Information,VB,5,2015,french,m,4/19/2025,Olga,Touquet,9.98,T,French,LC,3,"When the clouds are too full, water falls: this is called precipitation."
PAIK_VB_bot.docx,19,ChatGPT,10,"Ça peut être de la pluie, de la neige ou autre.",Information,VB,5,2015,french,m,4/19/2025,Olga,Touquet,9.98,T,French,LC,3,"It can be rain, snow or other."
PAIK_VB_bot.docx,19,ChatGPT,11,"Puis, l’eau retourne vers la terre, les rivières ou les nappes souterraines.",Information,VB,5,2015,french,m,4/19/2025,Olga,Touquet,9.98,T,French,LC,3,"Then, water returns to earth, rivers or underground tablecloths."
PAIK_VB_bot.docx,19,ChatGPT,12,Et le cycle recommence.,Information,VB,5,2015,french,m,4/19/2025,Olga,Touquet,9.98,T,French,LC,3,And the cycle starts again.
PAIK_VB_bot.docx,19,ChatGPT,13,Est-ce que tu veux en faire un petit jeu ou un dessin ?,Information,VB,5,2015,french,m,4/19/2025,Olga,Touquet,9.98,T,French,LC,3,Do you want to make it a little game or a drawing?
PAIK_VB_bot.docx,20,You,1,Je veux bien que tu me poses des questions.,Information,VB,5,2015,french,m,4/19/2025,Olga,Touquet,9.98,T,French,LC,3,I want you to ask me questions.
PAIK_VB_bot.docx,20,ChatGPT,1,"Très bien, avec plaisir.",Information,VB,5,2015,french,m,4/19/2025,Olga,Touquet,9.98,T,French,LC,3,"Very good, with pleasure."
PAIK_VB_bot.docx,20,ChatGPT,2,"Voici une première question :
Comment appelle-t-on le moment où l’eau devient de la vapeur à cause du soleil ?",Information,VB,5,2015,french,m,4/19/2025,Olga,Touquet,9.98,T,French,LC,3,"Here is a first question:
What do you call the moment when water becomes steam because of the sun?"
PAIK_VB_bot.docx,20,ChatGPT,3,Je t’écoute quand tu veux répondre.,Information,VB,5,2015,french,m,4/19/2025,Olga,Touquet,9.98,T,French,LC,3,I listen to you when you want to answer.
PAIK_VB_bot.docx,21,You,1,Ça s'appelle l'évaporisation.,Information,VB,5,2015,french,m,4/19/2025,Olga,Touquet,9.98,T,French,LC,3,It's called evaporization.
PAIK_VB_bot.docx,21,ChatGPT,1,"Oui, c’est très proche !",Information,VB,5,2015,french,m,4/19/2025,Olga,Touquet,9.98,T,French,LC,3,"Yes, it's very close!"
PAIK_VB_bot.docx,21,ChatGPT,2,"Le mot qu’on utilise le plus souvent est évaporation, sans le “-is-” au milieu.",Information,VB,5,2015,french,m,4/19/2025,Olga,Touquet,9.98,T,French,LC,3,"The word we use most often is evaporation, without the ""-is-"" in the middle."
PAIK_VB_bot.docx,21,ChatGPT,3,Mais tu as bien compris l’idée.,Information,VB,5,2015,french,m,4/19/2025,Olga,Touquet,9.98,T,French,LC,3,But you understood the idea.
PAIK_VB_bot.docx,21,ChatGPT,4,Prêt ou prête pour une autre question ?,Information,VB,5,2015,french,m,4/19/2025,Olga,Touquet,9.98,T,French,LC,3,Ready or ready for another question?
PAIK_VB_bot.docx,21,ChatGPT,5,"Quand la vapeur d’eau se transforme en petites gouttes dans le ciel, pour former les nuages, comment appelle-t-on ce changement ?",Information,VB,5,2015,french,m,4/19/2025,Olga,Touquet,9.98,T,French,LC,3,"When water vapor turns into small drops in the sky, to form the clouds, what do you call this change?"
PAIK_VB_bot.docx,22,You,1,Ça s'appelle la condamnation.,Information,VB,5,2015,french,m,4/19/2025,Olga,Touquet,9.98,T,French,LC,3,It's called the conviction.
PAIK_VB_bot.docx,22,You,2,J'ai fini de parler.,Information,VB,5,2015,french,m,4/19/2025,Olga,Touquet,9.98,T,French,LC,3,I finished talking.
PAIK_VB_bot.docx,22,ChatGPT,1,Tu étais tout près !,Information,VB,5,2015,french,m,4/19/2025,Olga,Touquet,9.98,T,French,LC,3,You were close!
PAIK_VB_bot.docx,22,ChatGPT,2,"Le bon mot est condensation, pas “condamnation” — c’est un autre mot qui veut dire quelque chose de très différent.",Information,VB,5,2015,french,m,4/19/2025,Olga,Touquet,9.98,T,French,LC,3,"The right word is condensation, not ""condemnation"" - it is another word that means something very different."
PAIK_VB_bot.docx,22,ChatGPT,3,Mais tu avais la bonne idée en tête.,Information,VB,5,2015,french,m,4/19/2025,Olga,Touquet,9.98,T,French,LC,3,But you had the good idea in mind.
PAIK_VB_bot.docx,22,ChatGPT,4,Merci d’avoir pris le temps de parler avec moi aujourd’hui.,Information,VB,5,2015,french,m,4/19/2025,Olga,Touquet,9.98,T,French,LC,3,Thank you for taking the time to speak with me today.
PAIK_VB_bot.docx,22,ChatGPT,5,"Voici le résumé de notre conversation, comme promis :",Information,VB,5,2015,french,m,4/19/2025,Olga,Touquet,9.98,T,French,LC,3,"Here is the summary of our conversation, as promised:"
PAIK_VB_bot.docx,22,ChatGPT,6,Toi : Est-ce que tu peux aider à comprendre ce que c'est le cycle de l'eau?,Information,VB,5,2015,french,m,4/19/2025,Olga,Touquet,9.98,T,French,LC,3,You: Can you help understand what the water cycle is?
PAIK_VB_bot.docx,22,ChatGPT,7,TP-bot : Bien sûr.,Information,VB,5,2015,french,m,4/19/2025,Olga,Touquet,9.98,T,French,LC,3,TP-BOT: Of course.
PAIK_VB_bot.docx,22,ChatGPT,8,"Le cycle de l’eau, c’est un mouvement qui ne s’arrête jamais…
Toi : Um, no.",Information,VB,5,2015,french,m,4/19/2025,Olga,Touquet,9.98,T,French,LC,3,"The water cycle is a movement that never stops ...
You: um, no."
PAIK_VB_bot.docx,22,ChatGPT,9,TP-bot : D’accord.,Information,VB,5,2015,french,m,4/19/2025,Olga,Touquet,9.98,T,French,LC,3,TP-bot : D’accord.
PAIK_VB_bot.docx,22,ChatGPT,10,"Quand tu dis “um, no,” est-ce que tu voulais dire que tout était clair pour toi ?",Information,VB,5,2015,french,m,4/19/2025,Olga,Touquet,9.98,T,French,LC,3,"When you say “Um, no,” Did you mean that everything was clear for you?"
PAIK_VB_bot.docx,22,ChatGPT,11,"…
Toi : Merci.",Information,VB,5,2015,french,m,4/19/2025,Olga,Touquet,9.98,T,French,LC,3,"…
You: Thank you."
PAIK_VB_bot.docx,22,ChatGPT,12,Tu veux qu'il te teste pour que tu aies compris ?,Information,VB,5,2015,french,m,4/19/2025,Olga,Touquet,9.98,T,French,LC,3,Do you want him to test you so that you understand?
PAIK_VB_bot.docx,22,ChatGPT,13,Oui.,Information,VB,5,2015,french,m,4/19/2025,Olga,Touquet,9.98,T,French,LC,3,Oui.
PAIK_VB_bot.docx,22,ChatGPT,14,Tu peux lui demander ça.,Information,VB,5,2015,french,m,4/19/2025,Olga,Touquet,9.98,T,French,LC,3,You can ask him.
PAIK_VB_bot.docx,22,ChatGPT,15,Peux-tu me tester ?,Information,VB,5,2015,french,m,4/19/2025,Olga,Touquet,9.98,T,French,LC,3,Can you test me?
PAIK_VB_bot.docx,22,ChatGPT,16,Si j'ai compris.,Information,VB,5,2015,french,m,4/19/2025,Olga,Touquet,9.98,T,French,LC,3,If I understood.
PAIK_VB_bot.docx,22,ChatGPT,17,TP-bot : Bien sûr.,Information,VB,5,2015,french,m,4/19/2025,Olga,Touquet,9.98,T,French,LC,3,TP-BOT: Of course.
PAIK_VB_bot.docx,22,ChatGPT,18,"Tu peux dire gentiment : “Peux-tu me poser une question pour voir si j’ai bien compris…”
Toi : Je pense être semée dans les nuages.",Information,VB,5,2015,french,m,4/19/2025,Olga,Touquet,9.98,T,French,LC,3,"You can say kindly: ""Can you ask me a question to see if I understood correctly ...""
You: I think I am sown in the clouds."
PAIK_VB_bot.docx,22,ChatGPT,19,"TP-bot : Ah, tu veux peut-être dire que l’eau ""se met dans les nuages""…
Toi : Je pense que tu veux recommencer ?",Information,VB,5,2015,french,m,4/19/2025,Olga,Touquet,9.98,T,French,LC,3,"TP-BOT: Ah, you may want to say that the water ""puts itself in the clouds"" ...
You: I think you want to start again?"
PAIK_VB_bot.docx,22,ChatGPT,20,Oui.,Information,VB,5,2015,french,m,4/19/2025,Olga,Touquet,9.98,T,French,LC,3,Oui.
PAIK_VB_bot.docx,22,ChatGPT,21,Ok.,Information,VB,5,2015,french,m,4/19/2025,Olga,Touquet,9.98,T,French,LC,3,Ok.
PAIK_VB_bot.docx,22,ChatGPT,22,"Tu pourrais essayer de lui parler, on va voir si ça marche.",Information,VB,5,2015,french,m,4/19/2025,Olga,Touquet,9.98,T,French,LC,3,"You could try to talk to him, we're going to see if it works."
PAIK_VB_bot.docx,22,ChatGPT,23,"TP-bot : D’accord, je vais te poser une autre question…
Toi : Les vaporisations.",Information,VB,5,2015,french,m,4/19/2025,Olga,Touquet,9.98,T,French,LC,3,"TP-BOT: Okay, I'll ask you another question ...
You: Vaporizations."
PAIK_VB_bot.docx,22,ChatGPT,24,"TP-bot : Tu as bien essayé, et c’est un mot qui ressemble à “évaporation”...",Information,VB,5,2015,french,m,4/19/2025,Olga,Touquet,9.98,T,French,LC,3,"TP-BOT: You tried well, and it's a word that looks like ""evaporation"" ..."
PAIK_VB_bot.docx,22,ChatGPT,25,Toi : J'aime bien.,Information,VB,5,2015,french,m,4/19/2025,Olga,Touquet,9.98,T,French,LC,3,You: I like it.
PAIK_VB_bot.docx,22,ChatGPT,26,TP-bot : C’est très gentil de le dire.,Information,VB,5,2015,french,m,4/19/2025,Olga,Touquet,9.98,T,French,LC,3,TP-BOT: It's very nice to say.
PAIK_VB_bot.docx,22,ChatGPT,27,Merci beaucoup.,Information,VB,5,2015,french,m,4/19/2025,Olga,Touquet,9.98,T,French,LC,3,Thank you so much.
PAIK_VB_bot.docx,22,ChatGPT,28,"Alors, reprenons doucement…
Toi : Je veux bien que tu me poses des questions.",Information,VB,5,2015,french,m,4/19/2025,Olga,Touquet,9.98,T,French,LC,3,"So let's go back slowly ...
You: I want you to ask me questions."
PAIK_VB_bot.docx,22,ChatGPT,29,"TP-bot : Très bien, avec plaisir.",Information,VB,5,2015,french,m,4/19/2025,Olga,Touquet,9.98,T,French,LC,3,"TP-BOT: Very good, with pleasure."
PAIK_VB_bot.docx,22,ChatGPT,30,"Voici une première question…
Toi : Ça s'appelle l'évaporisation.",Information,VB,5,2015,french,m,4/19/2025,Olga,Touquet,9.98,T,French,LC,3,"Here is a first question ...
You: It's called evaporization."
