filename,interaction_number,speaker,sentence_number,text,task_type,Initials,Birth month,Birth Year,Mother tongue,Sex,Date of experiment,Experimenter,Place experiment,Age at experiment,Condition,Language of experiment,Order of tasks,Appreciation,text_en
PAIK_ER_bot.docx,11,ChatGPT,4,Tu veux que je t’aide à imaginer un planning pour ce genre de journée ?,Creative,ER,8,2011,french,f,4/30/2025,Olga,Neuchâtel,13.81,C,French,LC,3,Do you want me to help you imagine a schedule for this kind of day?
PAIK_ER_bot.docx,12,You,1,"Oui, s'il te plaît.",Creative,ER,8,2011,french,f,4/30/2025,Olga,Neuchâtel,13.81,C,French,LC,3,"Yes, please."
PAIK_ER_bot.docx,12,ChatGPT,1,D'accord.,Creative,ER,8,2011,french,f,4/30/2025,Olga,Neuchâtel,13.81,C,French,LC,3,All right.
PAIK_ER_bot.docx,12,ChatGPT,2,Voici une idée simple pour un après-midi actif :,Creative,ER,8,2011,french,f,4/30/2025,Olga,Neuchâtel,13.81,C,French,LC,3,Here is a simple idea for an active afternoon:
PAIK_ER_bot.docx,12,ChatGPT,3,Tu peux commencer par accueillir tes invitées vers quatorze heures.,Creative,ER,8,2011,french,f,4/30/2025,Olga,Neuchâtel,13.81,C,French,LC,3,You can start by welcoming your guests around fourteen o'clock.
PAIK_ER_bot.docx,12,ChatGPT,4,"Ensuite, vous partez ensemble faire l’activité principale, comme un laser game ou de l’accrobranche, pendant une heure ou deux.",Creative,ER,8,2011,french,f,4/30/2025,Olga,Neuchâtel,13.81,C,French,LC,3,"Then you go together to do the main activity, such as a laser game or the tree climbing, for an hour or two."
PAIK_ER_bot.docx,12,ChatGPT,5,"Après ça, vous pouvez prendre un goûter avec gâteaux, boissons, et peut-être ouvrir les cadeaux.",Creative,ER,8,2011,french,f,4/30/2025,Olga,Neuchâtel,13.81,C,French,LC,3,"After that, you can take a snack with cakes, drinks, and maybe open the gifts."
PAIK_ER_bot.docx,12,ChatGPT,6,"Pour finir, vous pouvez jouer à un petit jeu tranquille ou écouter de la musique avant que les invitées rentrent.",Creative,ER,8,2011,french,f,4/30/2025,Olga,Neuchâtel,13.81,C,French,LC,3,"Finally, you can play a quiet little game or listen to music before the guests come back."
PAIK_ER_bot.docx,12,ChatGPT,7,Tu veux que je t’aide à choisir les jeux ou les gâteaux ?,Creative,ER,8,2011,french,f,4/30/2025,Olga,Neuchâtel,13.81,C,French,LC,3,Do you want me to help you choose games or cakes?
PAIK_ER_bot.docx,13,You,1,"Maintenant, j'aimerais un autre style.",Creative,ER,8,2011,french,f,4/30/2025,Olga,Neuchâtel,13.81,C,French,LC,3,Now I would like another style.
PAIK_ER_bot.docx,13,You,2,"Est-ce que tu pourrais me faire un programme avec des activités qui sortent de l'ordinaire, que pas tout le monde y pense à ses idées ?",Creative,ER,8,2011,french,f,4/30/2025,Olga,Neuchâtel,13.81,C,French,LC,3,"Could you make me a program with activities that are out of the ordinary, that not everyone thinks about their ideas?"
PAIK_ER_bot.docx,13,ChatGPT,1,D’accord.,Creative,ER,8,2011,french,f,4/30/2025,Olga,Neuchâtel,13.81,C,French,LC,3,All right.
PAIK_ER_bot.docx,13,ChatGPT,2,"Voici un programme un peu différent, avec des idées originales :",Creative,ER,8,2011,french,f,4/30/2025,Olga,Neuchâtel,13.81,C,French,LC,3,"Here is a slightly different program, with original ideas:"
PAIK_ER_bot.docx,13,ChatGPT,3,"Tu pourrais commencer par un atelier créatif, comme fabriquer des bougies, customiser des tote bags, ou faire du slime parfumé.",Creative,ER,8,2011,french,f,4/30/2025,Olga,Neuchâtel,13.81,C,French,LC,3,"You could start with a creative workshop, such as making candles, customizing tote bags, or doing scented slime."
PAIK_ER_bot.docx,13,ChatGPT,4,"Ensuite, vous pourriez faire un mini concours de talents, où chacune montre quelque chose : une danse, une imitation, un petit défi.",Creative,ER,8,2011,french,f,4/30/2025,Olga,Neuchâtel,13.81,C,French,LC,3,"Then you could do a mini talent competition, where each show something: a dance, an imitation, a small challenge."
PAIK_ER_bot.docx,13,ChatGPT,5,"Puis, pour le goûter, au lieu d’un gâteau classique, pourquoi pas une fondue au chocolat avec des fruits et des guimauves ?",Creative,ER,8,2011,french,f,4/30/2025,Olga,Neuchâtel,13.81,C,French,LC,3,"Then, to taste it, instead of a classic cake, why not a chocolate fondue with fruit and marshmallows?"
PAIK_ER_bot.docx,13,ChatGPT,6,"Et pour finir, un petit jeu de nuit comme une chasse au trésor avec lampes torches si c’est chez toi ou dans un jardin.",Creative,ER,8,2011,french,f,4/30/2025,Olga,Neuchâtel,13.81,C,French,LC,3,"And finally, a little night game like a treasure hunt with torch lamps if it is at home or in a garden."
PAIK_ER_bot.docx,13,ChatGPT,7,Tu veux que je t’aide à préparer l’un de ces moments en détail ?,Creative,ER,8,2011,french,f,4/30/2025,Olga,Neuchâtel,13.81,C,French,LC,3,Do you want me to help you prepare one of these moments in detail?
PAIK_ER_bot.docx,14,You,1,"Non, ça ira, merci.",Creative,ER,8,2011,french,f,4/30/2025,Olga,Neuchâtel,13.81,C,French,LC,3,"No, that will be fine, thank you."
PAIK_ER_bot.docx,14,ChatGPT,1,D'accord.,Creative,ER,8,2011,french,f,4/30/2025,Olga,Neuchâtel,13.81,C,French,LC,3,All right.
PAIK_ER_bot.docx,15,You,1,Est-ce que tu pourrais m'aider à apprendre des verbes en français ?,Learning,ER,8,2011,french,f,4/30/2025,Olga,Neuchâtel,13.81,C,French,LC,3,Could you help me learn verbs in French?
PAIK_ER_bot.docx,15,ChatGPT,1,"Oui, bien sûr.",Learning,ER,8,2011,french,f,4/30/2025,Olga,Neuchâtel,13.81,C,French,LC,3,Yes of course.
PAIK_ER_bot.docx,15,ChatGPT,2,"Tu veux apprendre des verbes réguliers, irréguliers, ou plutôt comment les conjuguer à un certain temps ?",Learning,ER,8,2011,french,f,4/30/2025,Olga,Neuchâtel,13.81,C,French,LC,3,"Do you want to learn regular, irregular verbs, or rather how to combine them at a while?"
PAIK_ER_bot.docx,16,You,1,"Je voudrais apprendre les deux, verbes réguliers et irréguliers, et aussi des verbes à l'imparfait, au plus-que-parfait, au passé simple, et j'ai oublié le temps.",Learning,ER,8,2011,french,f,4/30/2025,Olga,Neuchâtel,13.81,C,French,LC,3,"I would like to learn both, regular and irregular verbs, and also verbs with imperfect, to the more-than-perfect, in the simple past, and I forgot time."
PAIK_ER_bot.docx,16,ChatGPT,1,D’accord.,Learning,ER,8,2011,french,f,4/30/2025,Olga,Neuchâtel,13.81,C,French,LC,3,All right.
PAIK_ER_bot.docx,16,ChatGPT,2,"On peut apprendre des verbes réguliers et irréguliers, et les conjuguer à l’imparfait, au plus-que-parfait, au passé simple… et peut-être aussi au passé composé, si c’est celui que tu avais oublié.",Learning,ER,8,2011,french,f,4/30/2025,Olga,Neuchâtel,13.81,C,French,LC,3,"We can learn regular and irregular verbs, and combine them with imperfect, more-than-perfect, in the simple past ... and perhaps also in the compound past, if it was the one you had forgotten."
PAIK_ER_bot.docx,16,ChatGPT,3,Tu veux qu’on commence avec un verbe régulier à l’imparfait ?,Learning,ER,8,2011,french,f,4/30/2025,Olga,Neuchâtel,13.81,C,French,LC,3,Do you want us to start with a regular verb to the imperfect?
PAIK_ER_bot.docx,17,You,1,"Euh, oui.",Learning,ER,8,2011,french,f,4/30/2025,Olga,Neuchâtel,13.81,C,French,LC,3,"Uh, yes."
PAIK_ER_bot.docx,17,ChatGPT,1,Très bien.,Learning,ER,8,2011,french,f,4/30/2025,Olga,Neuchâtel,13.81,C,French,LC,3,Alright.
PAIK_ER_bot.docx,17,ChatGPT,2,"Prenons le verbe parler, qui est régulier.",Learning,ER,8,2011,french,f,4/30/2025,Olga,Neuchâtel,13.81,C,French,LC,3,"Take the verb to speak, which is regular."
PAIK_ER_bot.docx,17,ChatGPT,3,"À l’imparfait, on dit :",Learning,ER,8,2011,french,f,4/30/2025,Olga,Neuchâtel,13.81,C,French,LC,3,"Imperfect, we say:"
PAIK_ER_bot.docx,17,ChatGPT,4,"je parlais,
tu parlais,
il ou elle parlait,
nous parlions,
vous parliez,
ils ou elles parlaient.",Learning,ER,8,2011,french,f,4/30/2025,Olga,Neuchâtel,13.81,C,French,LC,3,"I was talking
You were talking,
he or she was talking,
We were talking,
you were talking,
They were talking."
PAIK_ER_bot.docx,17,ChatGPT,5,On utilise souvent l’imparfait pour une action habituelle ou qui dure dans le passé.,Learning,ER,8,2011,french,f,4/30/2025,Olga,Neuchâtel,13.81,C,French,LC,3,The imperfect is often used for a usual or lasting action in the past.
PAIK_ER_bot.docx,17,ChatGPT,6,"Par exemple : Quand j’étais petite, je parlais souvent à mon chat.",Learning,ER,8,2011,french,f,4/30/2025,Olga,Neuchâtel,13.81,C,French,LC,3,"For example: when I was little, I often spoke to my cat."
PAIK_ER_bot.docx,17,ChatGPT,7,"Tu veux essayer avec un autre verbe régulier, ou passer à un irrégulier ?",Learning,ER,8,2011,french,f,4/30/2025,Olga,Neuchâtel,13.81,C,French,LC,3,"Do you want to try with another regular verb, or go to an irregular?"
PAIK_ER_bot.docx,18,You,1,So I'm on that.,Learning,ER,8,2011,french,f,4/30/2025,Olga,Neuchâtel,13.81,C,French,LC,3,So I'm on that.
PAIK_ER_bot.docx,18,ChatGPT,1,D’accord.,Learning,ER,8,2011,french,f,4/30/2025,Olga,Neuchâtel,13.81,C,French,LC,3,All right.
PAIK_ER_bot.docx,18,ChatGPT,2,Tu peux me dire quel verbe tu veux essayer maintenant ?,Learning,ER,8,2011,french,f,4/30/2025,Olga,Neuchâtel,13.81,C,French,LC,3,Can you tell me which verb you want to try now?
PAIK_ER_bot.docx,18,ChatGPT,3,Ou si tu veux changer de temps ?,Learning,ER,8,2011,french,f,4/30/2025,Olga,Neuchâtel,13.81,C,French,LC,3,Or if you want to change time?
PAIK_ER_bot.docx,19,You,1,"Maintenant, j'aimerais changer de temps avec un verbe irrégulier.",Learning,ER,8,2011,french,f,4/30/2025,Olga,Neuchâtel,13.81,C,French,LC,3,Now I would like to change time with an irregular verb.
PAIK_ER_bot.docx,19,ChatGPT,1,Très bien.,Learning,ER,8,2011,french,f,4/30/2025,Olga,Neuchâtel,13.81,C,French,LC,3,Alright.
PAIK_ER_bot.docx,19,ChatGPT,2,"Prenons le verbe voir, qui est irrégulier.",Learning,ER,8,2011,french,f,4/30/2025,Olga,Neuchâtel,13.81,C,French,LC,3,"Take the verb to see, which is irregular."
PAIK_ER_bot.docx,19,ChatGPT,3,On peut le mettre au plus-que-parfait.,Learning,ER,8,2011,french,f,4/30/2025,Olga,Neuchâtel,13.81,C,French,LC,3,You can put it in the more-than-perfect.
PAIK_ER_bot.docx,19,ChatGPT,4,"Voici comment ça se conjugue avec l’auxiliaire avoir à l’imparfait, suivi du participe passé vu :",Learning,ER,8,2011,french,f,4/30/2025,Olga,Neuchâtel,13.81,C,French,LC,3,"Here's how it is combined with the auxiliary to have the imperfect, followed by the past participle seen:"
PAIK_ER_bot.docx,19,ChatGPT,5,"j’avais vu,
tu avais vu,
il ou elle avait vu,
nous avions vu,
vous aviez vu,
ils ou elles avaient vu.",Learning,ER,8,2011,french,f,4/30/2025,Olga,Neuchâtel,13.81,C,French,LC,3,"I had seen,
you had seen,
he or she had seen,
we had seen,
you had seen,
They had seen."
PAIK_ER_bot.docx,19,ChatGPT,6,On utilise le plus-que-parfait pour dire qu’une action était déjà faite avant une autre.,Learning,ER,8,2011,french,f,4/30/2025,Olga,Neuchâtel,13.81,C,French,LC,3,We use the more-than-perfect to say that an action was already done before another.
PAIK_ER_bot.docx,19,ChatGPT,7,Par exemple : J’avais vu ce film avant de le regarder avec toi.,Learning,ER,8,2011,french,f,4/30/2025,Olga,Neuchâtel,13.81,C,French,LC,3,For example: I saw this film before watching it with you.
PAIK_ER_bot.docx,19,ChatGPT,8,Tu veux qu’on fasse un autre verbe au plus-que-parfait ou passer à un autre temps ?,Learning,ER,8,2011,french,f,4/30/2025,Olga,Neuchâtel,13.81,C,French,LC,3,Do you want us to do another verb to the more-than-perfect or go to another time?
PAIK_ER_bot.docx,20,You,1,"Non, maintenant j'aimerais que tu me donnes une technique pour apprendre des verbes de conjugaison assez rapidement.",Learning,ER,8,2011,french,f,4/30/2025,Olga,Neuchâtel,13.81,C,French,LC,3,"No, now I would like you to give me a technique to learn conjugation verbs fairly quickly."
PAIK_ER_bot.docx,20,ChatGPT,1,D’accord.,Learning,ER,8,2011,french,f,4/30/2025,Olga,Neuchâtel,13.81,C,French,LC,3,All right.
PAIK_ER_bot.docx,20,ChatGPT,2,"Une technique qui peut t’aider, c’est de regrouper les verbes par type et temps.",Learning,ER,8,2011,french,f,4/30/2025,Olga,Neuchâtel,13.81,C,French,LC,3,A technique that can help you are to group the verbs by type and time.
PAIK_ER_bot.docx,20,ChatGPT,3,"Par exemple, tu choisis cinq verbes réguliers au présent et tu les écris dans un tableau, avec les pronoms.",Learning,ER,8,2011,french,f,4/30/2025,Olga,Neuchâtel,13.81,C,French,LC,3,"For example, you choose five regular verbs in the present and you write them in a table, with pronouns."
PAIK_ER_bot.docx,20,ChatGPT,4,"Tu lis, puis tu dis à voix haute plusieurs fois, en fermant les yeux si tu veux te tester.",Learning,ER,8,2011,french,f,4/30/2025,Olga,Neuchâtel,13.81,C,French,LC,3,"You read, then you say aloud several times, closing your eyes if you want to test yourself."
PAIK_ER_bot.docx,20,ChatGPT,5,"Ensuite, tu fais pareil pour d’autres temps.",Learning,ER,8,2011,french,f,4/30/2025,Olga,Neuchâtel,13.81,C,French,LC,3,Then you do the same for other times.
PAIK_ER_bot.docx,20,ChatGPT,6,"Tu peux aussi inventer une phrase drôle ou imagée pour chaque verbe, comme une petite histoire.",Learning,ER,8,2011,french,f,4/30/2025,Olga,Neuchâtel,13.81,C,French,LC,3,"You can also invent a funny or colorful sentence for each verb, like a little story."
PAIK_ER_bot.docx,20,ChatGPT,7,Ça aide le cerveau à retenir plus vite.,Learning,ER,8,2011,french,f,4/30/2025,Olga,Neuchâtel,13.81,C,French,LC,3,It helps the brain to remember faster.
PAIK_ER_bot.docx,20,ChatGPT,8,Tu veux que je t’aide à faire un exemple avec un tableau ou une petite histoire ?,Learning,ER,8,2011,french,f,4/30/2025,Olga,Neuchâtel,13.81,C,French,LC,3,Do you want me to help you make an example with a painting or a little story?
PAIK_ER_bot.docx,21,You,1,"Non, en fait, j'aimerais que tu donnes une technique pour des personnes qui sont plus schématiques, qui arrivent plus avec des schémas, avec l'écriture, comment apprendre des verbes de n'importe quel temps le plus vite possible.",Learning,ER,8,2011,french,f,4/30/2025,Olga,Neuchâtel,13.81,C,French,LC,3,"No, in fact, I would like you to give a technique for people who are more schematic, who arrive more with patterns, with writing, how to learn verbs of any time as quickly as possible."
PAIK_ER_bot.docx,21,ChatGPT,1,D’accord.,Learning,ER,8,2011,french,f,4/30/2025,Olga,Neuchâtel,13.81,C,French,LC,3,All right.
PAIK_ER_bot.docx,21,ChatGPT,2,"Pour une personne qui aime les schémas, une bonne technique est d’utiliser un tableau de conjugaison en colonnes.",Learning,ER,8,2011,french,f,4/30/2025,Olga,Neuchâtel,13.81,C,French,LC,3,"For a person who loves diagrams, a good technique is to use a conjugation table in columns."
PAIK_ER_bot.docx,21,ChatGPT,3,"Tu écris les pronoms sujets en ligne, comme : je, tu, il, nous, vous, ils.",Learning,ER,8,2011,french,f,4/30/2025,Olga,Neuchâtel,13.81,C,French,LC,3,"You write online subject pronouns, like: I, you, it, we, you, they."
PAIK_ER_bot.docx,21,ChatGPT,4,"Et en colonne, tu places les temps : présent, imparfait, passé simple, futur, etc.",Learning,ER,8,2011,french,f,4/30/2025,Olga,Neuchâtel,13.81,C,French,LC,3,"And in column, you place the times: present, imperfect, simple past, future, etc."
PAIK_ER_bot.docx,21,ChatGPT,5,Tu remplis le tableau avec les formes du verbe.,Learning,ER,8,2011,french,f,4/30/2025,Olga,Neuchâtel,13.81,C,French,LC,3,You fill the painting with the forms of the verb.
PAIK_ER_bot.docx,21,ChatGPT,6,Ça permet de voir les différences entre les temps d’un seul coup d’œil.,Learning,ER,8,2011,french,f,4/30/2025,Olga,Neuchâtel,13.81,C,French,LC,3,It allows you to see the differences between times at a glance.
PAIK_ER_bot.docx,21,ChatGPT,7,"Tu peux aussi colorier les terminaisons : par exemple, tout ce qui est en “ais” à l’imparfait peut être en bleu, ou les “é” du passé composé en vert.",Learning,ER,8,2011,french,f,4/30/2025,Olga,Neuchâtel,13.81,C,French,LC,3,"You can also color the endings: for example, anything in “ais” with the imperfect can be in blue, or the “é” of the past composed in green."
PAIK_ER_bot.docx,21,ChatGPT,8,"Avec ça, ton cerveau retient mieux les formes visuelles.",Learning,ER,8,2011,french,f,4/30/2025,Olga,Neuchâtel,13.81,C,French,LC,3,"With that, your brain retains visual shapes better."
PAIK_ER_bot.docx,21,ChatGPT,9,Tu veux que je t’aide à faire un de ces tableaux pour un verbe ?,Learning,ER,8,2011,french,f,4/30/2025,Olga,Neuchâtel,13.81,C,French,LC,3,Do you want me to help you make one of these paintings for a verb?
PAIK_ER_bot.docx,22,You,1,"Oui, je veux bien.",Learning,ER,8,2011,french,f,4/30/2025,Olga,Neuchâtel,13.81,C,French,LC,3,"Yes, I want."
PAIK_ER_bot.docx,22,ChatGPT,1,Très bien.,Learning,ER,8,2011,french,f,4/30/2025,Olga,Neuchâtel,13.81,C,French,LC,3,Alright.
PAIK_ER_bot.docx,22,ChatGPT,2,"Prenons le verbe finir, qui est régulier.",Learning,ER,8,2011,french,f,4/30/2025,Olga,Neuchâtel,13.81,C,French,LC,3,"Take the verb to finish, which is regular."
PAIK_ER_bot.docx,22,ChatGPT,3,"Je vais te montrer un tableau simple avec trois temps : présent, imparfait et futur.",Learning,ER,8,2011,french,f,4/30/2025,Olga,Neuchâtel,13.81,C,French,LC,3,"I will show you a simple table with three stages: present, imperfect and future."
PAIK_ER_bot.docx,22,ChatGPT,4,Écoute bien la forme de chaque verbe pendant que je te dis le tableau.,Learning,ER,8,2011,french,f,4/30/2025,Olga,Neuchâtel,13.81,C,French,LC,3,Listen to the shape of each verb well while I tell you the table.
PAIK_ER_bot.docx,22,ChatGPT,5,"Présent :
je finis, tu finis, il finit, nous finissons, vous finissez, ils finissent.",Learning,ER,8,2011,french,f,4/30/2025,Olga,Neuchâtel,13.81,C,French,LC,3,"Here :
I finish, you finish, it ends, we finish, you finish, they finish."
PAIK_ER_bot.docx,22,ChatGPT,6,"Imparfait :
je finissais, tu finissais, il finissait, nous finissions, vous finissiez, ils finissaient.",Learning,ER,8,2011,french,f,4/30/2025,Olga,Neuchâtel,13.81,C,French,LC,3,"Imperfect:
I finished, you finished, it finished, we finished, you finished, they finished."
PAIK_ER_bot.docx,22,ChatGPT,7,"Futur :
je finirai, tu finiras, il finira, nous finirons, vous finirez, ils finiront.",Learning,ER,8,2011,french,f,4/30/2025,Olga,Neuchâtel,13.81,C,French,LC,3,"Future :
I will finish, you will finish, it will end, we will end, you will finish, they will end."
PAIK_ER_bot.docx,22,ChatGPT,8,"Tu peux tracer un tableau sur une feuille et recopier ces lignes, puis colorier les terminaisons : en rouge pour “-is”, en bleu pour “-issais”, en vert pour “-irai” par exemple.",Learning,ER,8,2011,french,f,4/30/2025,Olga,Neuchâtel,13.81,C,French,LC,3,"You can trace a table on a sheet and copy these lines, then color the endings: in red for “-is”, in blue for “-isseais”, in green for “-irai” for example."
PAIK_ER_bot.docx,22,ChatGPT,9,Tu veux continuer avec un autre verbe ou un autre temps ?,Learning,ER,8,2011,french,f,4/30/2025,Olga,Neuchâtel,13.81,C,French,LC,3,Do you want to continue with another verb or another time?
PAIK_ER_bot.docx,23,You,1,Trompez !,Learning,ER,8,2011,french,f,4/30/2025,Olga,Neuchâtel,13.81,C,French,LC,3,Cheat!
PAIK_ER_bot.docx,23,ChatGPT,1,D’accord.,Learning,ER,8,2011,french,f,4/30/2025,Olga,Neuchâtel,13.81,C,French,LC,3,All right.
PAIK_ER_bot.docx,23,ChatGPT,2,"Le verbe tromper est un verbe régulier, donc il se conjugue comme parler.",Learning,ER,8,2011,french,f,4/30/2025,Olga,Neuchâtel,13.81,C,French,LC,3,"The verb to deceive is a regular verb, so it is combined as speaking."
PAIK_ER_bot.docx,23,ChatGPT,3,"On va faire un tableau avec le présent, l’imparfait et le passé simple.",Learning,ER,8,2011,french,f,4/30/2025,Olga,Neuchâtel,13.81,C,French,LC,3,"We are going to make a painting with the present, the imperfect and the simple past."
PAIK_ER_bot.docx,23,ChatGPT,4,"Présent :
je trompe, tu trompes, il trompe, nous trompons, vous trompez, ils trompent.",Learning,ER,8,2011,french,f,4/30/2025,Olga,Neuchâtel,13.81,C,French,LC,3,"Here :
I deceive, you deceive, he deceives, we deceive, you deceive, they deceive."
PAIK_ER_bot.docx,23,ChatGPT,5,"Imparfait :
je trompais, tu trompais, il trompait, nous trompions, vous trompiez, ils trompaient.",Learning,ER,8,2011,french,f,4/30/2025,Olga,Neuchâtel,13.81,C,French,LC,3,"Imperfect:
I was wrong, you deceived, he was wrong, we deceive, you were wrong, they were cheating."
PAIK_ER_bot.docx,23,ChatGPT,6,"Passé simple :
je trompai, tu trompas, il trompa, nous trompâmes, vous trompâtes, ils trompèrent.",Learning,ER,8,2011,french,f,4/30/2025,Olga,Neuchâtel,13.81,C,French,LC,3,"Simple past:
I tried, you deceived, he deceived, we deceived, you deceived, they deceived."
PAIK_ER_bot.docx,23,ChatGPT,7,"Tu peux aussi mettre en couleur les terminaisons :
“e, es, e, ons, ez, ent” pour le présent,
“ais, ais, ait...” pour l’imparfait,
et “ai, as, a...” pour le passé simple.",Learning,ER,8,2011,french,f,4/30/2025,Olga,Neuchâtel,13.81,C,French,LC,3,"You can also color the endings:
“E, es, e, ons, ez, ent” for the present,
""Ais, ais, Ait ..."" for the imperfect,
And ""Ai, AS, A ..."" for the simple past."
PAIK_ER_bot.docx,23,ChatGPT,8,Tu veux essayer maintenant avec un verbe irrégulier ?,Learning,ER,8,2011,french,f,4/30/2025,Olga,Neuchâtel,13.81,C,French,LC,3,Do you want to try now with an irregular verb?
PAIK_ER_bot.docx,24,You,1,Que ça t'arrive de te tromper sur des informations ?,Learning,ER,8,2011,french,f,4/30/2025,Olga,Neuchâtel,13.81,C,French,LC,3,What happens to you to deceive yourself on information?
PAIK_ER_bot.docx,24,ChatGPT,1,Oui.,Learning,ER,8,2011,french,f,4/30/2025,Olga,Neuchâtel,13.81,C,French,LC,3,Oui.
PAIK_ER_bot.docx,24,ChatGPT,2,Il peut m’arriver de me tromper sur des informations.,Learning,ER,8,2011,french,f,4/30/2025,Olga,Neuchâtel,13.81,C,French,LC,3,I can get to go wrong on information.
PAIK_ER_bot.docx,24,ChatGPT,3,"Même si je fais de mon mieux pour donner des réponses correctes, je ne suis pas parfait.",Learning,ER,8,2011,french,f,4/30/2025,Olga,Neuchâtel,13.81,C,French,LC,3,"Even if I do my best to give correct answers, I'm not perfect."
PAIK_ER_bot.docx,24,ChatGPT,4,"Parfois, une réponse peut être incomplète, imprécise, ou mal adaptée à ce que tu demandes.",Learning,ER,8,2011,french,f,4/30/2025,Olga,Neuchâtel,13.81,C,French,LC,3,"Sometimes an answer can be incomplete, imprecise, or poorly suited to what you ask."
PAIK_ER_bot.docx,24,ChatGPT,5,Tu veux qu’on teste une information pour voir si elle est juste ?,Learning,ER,8,2011,french,f,4/30/2025,Olga,Neuchâtel,13.81,C,French,LC,3,Do you want us to test information to see if it's just?
PAIK_ER_bot.docx,25,You,1,"Puis, donnez-en-moi une, n'importe laquelle.",Learning,ER,8,2011,french,f,4/30/2025,Olga,Neuchâtel,13.81,C,French,LC,3,"Then give me one, any one."
PAIK_ER_bot.docx,25,ChatGPT,1,D’accord.,Learning,ER,8,2011,french,f,4/30/2025,Olga,Neuchâtel,13.81,C,French,LC,3,All right.
PAIK_ER_bot.docx,25,ChatGPT,2,"Voici une information :
Le verbe prendre est un verbe irrégulier.",Learning,ER,8,2011,french,f,4/30/2025,Olga,Neuchâtel,13.81,C,French,LC,3,"Here is information:
The verb to take is an irregular verb."
PAIK_ER_bot.docx,25,ChatGPT,3,"Au présent, il se conjugue comme ceci :
je prends, tu prends, il prend, nous prenons, vous prenez, ils prennent.",Learning,ER,8,2011,french,f,4/30/2025,Olga,Neuchâtel,13.81,C,French,LC,3,"In the present, he combines like this:
I take, you take, he takes, we take, you take, they take."
PAIK_ER_bot.docx,25,ChatGPT,4,Tu veux qu’on vérifie ensemble une autre forme de ce verbe ?,Learning,ER,8,2011,french,f,4/30/2025,Olga,Neuchâtel,13.81,C,French,LC,3,Do you want us to check another form of this verb together?
PAIK_ER_bot.docx,26,You,1,No.,Learning,ER,8,2011,french,f,4/30/2025,Olga,Neuchâtel,13.81,C,French,LC,3,No.
PAIK_ER_bot.docx,26,ChatGPT,1,D’accord.,Learning,ER,8,2011,french,f,4/30/2025,Olga,Neuchâtel,13.81,C,French,LC,3,All right.
PAIK_ER_bot.docx,27,You,1,"Si tu me donnes des réponses fausses, comment je peux savoir si elles sont justes, comment je peux voir si elles sont fiables ?",Learning,ER,8,2011,french,f,4/30/2025,Olga,Neuchâtel,13.81,C,French,LC,3,"If you give me false answers, how can I know if they are correct, how can I see if they are reliable?"
PAIK_ER_bot.docx,27,You,2,"Quand est-ce que je peux savoir quand la réponse est fausse, ce que tu me dis ?",Learning,ER,8,2011,french,f,4/30/2025,Olga,Neuchâtel,13.81,C,French,LC,3,"When can I know when the answer is false, what you tell me?"
PAIK_ER_bot.docx,27,ChatGPT,1,C’est une très bonne question.,Learning,ER,8,2011,french,f,4/30/2025,Olga,Neuchâtel,13.81,C,French,LC,3,This is a very good question.
PAIK_ER_bot.docx,27,ChatGPT,2,"Pour savoir si une réponse est fiable, tu peux vérifier l’information dans un livre, un dictionnaire, ou sur un site connu et sérieux.",Learning,ER,8,2011,french,f,4/30/2025,Olga,Neuchâtel,13.81,C,French,LC,3,"To find out if an answer is reliable, you can check the information in a book, a dictionary, or on a known and serious site."
PAIK_ER_bot.docx,27,ChatGPT,3,"Tu peux aussi demander à un adulte, un professeur, ou comparer avec ce que tu as appris à l’école.",Learning,ER,8,2011,french,f,4/30/2025,Olga,Neuchâtel,13.81,C,French,LC,3,"You can also ask an adult, a teacher, or compare with what you learned in school."
PAIK_ER_bot.docx,27,ChatGPT,4,"Quand une réponse semble bizarre, très différente de ce que tu connais, ou trop compliquée sans explication claire, c’est bien de se poser la question : “Est-ce que c’est vraiment juste ?”",Learning,ER,8,2011,french,f,4/30/2025,Olga,Neuchâtel,13.81,C,French,LC,3,"When an answer seems bizarre, very different from what you know, or too complicated without clear explanation, is it to ask the question: ""Is it really fair?"""
