filename,interaction_number,speaker,sentence_number,text,task_type,Initials,Birth month,Birth Year,Mother tongue,Sex,Date of experiment,Experimenter,Place experiment,Age at experiment,Condition,Language of experiment,Order of tasks,Appreciation,text_en
PAIK_EL_bot.docx,39,ChatGPT,1,I'm glad you're curious—that’s how you learn amazing things!,Learning,EL,5,2014,french / english,m,5/7/2025,Paco,Neuchâtel,11.06,T,English,LC,2,I'm glad you're curious—that’s how you learn amazing things!
PAIK_EL_bot.docx,39,ChatGPT,2,"Here’s another one: the word gens, which means “people.” It’s always plural, but it acts a little funny with adjectives.",Learning,EL,5,2014,french / english,m,5/7/2025,Paco,Neuchâtel,11.06,T,English,LC,2,"Here’s another one: the word gens, which means “people.” It’s always plural, but it acts a little funny with adjectives."
PAIK_EL_bot.docx,39,ChatGPT,3,"For example, if you say “kind people,” you’d say les gens gentils—using the masculine form gentils.",Learning,EL,5,2014,french / english,m,5/7/2025,Paco,Neuchâtel,11.06,T,English,LC,2,"For example, if you say “kind people,” you’d say les gens gentils—using the masculine form gentils."
PAIK_EL_bot.docx,39,ChatGPT,4,"But if there’s a feminine adjective before the word gens, like petites for “small,” the whole phrase becomes les petites gens.",Learning,EL,5,2014,french / english,m,5/7/2025,Paco,Neuchâtel,11.06,T,English,LC,2,"But if there’s a feminine adjective before the word gens, like petites for “small,” the whole phrase becomes les petites gens."
PAIK_EL_bot.docx,39,ChatGPT,5,So sometimes the adjectives around it switch between masculine and feminine!,Learning,EL,5,2014,french / english,m,5/7/2025,Paco,Neuchâtel,11.06,T,English,LC,2,So sometimes the adjectives around it switch between masculine and feminine!
PAIK_EL_bot.docx,39,ChatGPT,6,"Strange, right?",Learning,EL,5,2014,french / english,m,5/7/2025,Paco,Neuchâtel,11.06,T,English,LC,2,"Strange, right?"
PAIK_EL_bot.docx,39,ChatGPT,7,Would you like to try making a sentence with gens together?,Learning,EL,5,2014,french / english,m,5/7/2025,Paco,Neuchâtel,11.06,T,English,LC,2,Would you like to try making a sentence with gens together?
PAIK_EL_bot.docx,40,You,1,"Yes, please!",Learning,EL,5,2014,french / english,m,5/7/2025,Paco,Neuchâtel,11.06,T,English,LC,2,"Yes, please!"
PAIK_EL_bot.docx,40,ChatGPT,1,All right!,Learning,EL,5,2014,french / english,m,5/7/2025,Paco,Neuchâtel,11.06,T,English,LC,2,All right!
PAIK_EL_bot.docx,40,ChatGPT,2,Let’s try this one together.,Learning,EL,5,2014,french / english,m,5/7/2025,Paco,Neuchâtel,11.06,T,English,LC,2,Let’s try this one together.
PAIK_EL_bot.docx,40,ChatGPT,3,"If we want to say nice people in French, and we’re putting the adjective after the word, we’d say les gens gentils.",Learning,EL,5,2014,french / english,m,5/7/2025,Paco,Neuchâtel,11.06,T,English,LC,2,"If we want to say nice people in French, and we’re putting the adjective after the word, we’d say les gens gentils."
PAIK_EL_bot.docx,40,ChatGPT,4,Can you try saying that out loud?,Learning,EL,5,2014,french / english,m,5/7/2025,Paco,Neuchâtel,11.06,T,English,LC,2,Can you try saying that out loud?
PAIK_EL_bot.docx,40,ChatGPT,5,Les gens gentils.,Learning,EL,5,2014,french / english,m,5/7/2025,Paco,Neuchâtel,11.06,T,English,LC,2,Les gens gentils.
PAIK_EL_bot.docx,40,ChatGPT,6,"Now, if we want to say little people—and this time the adjective comes before—we’d say les petites gens.",Learning,EL,5,2014,french / english,m,5/7/2025,Paco,Neuchâtel,11.06,T,English,LC,2,"Now, if we want to say little people—and this time the adjective comes before—we’d say les petites gens."
PAIK_EL_bot.docx,40,ChatGPT,7,Would you like to try saying that one too?,Learning,EL,5,2014,french / english,m,5/7/2025,Paco,Neuchâtel,11.06,T,English,LC,2,Would you like to try saying that one too?
PAIK_EL_bot.docx,41,You,1,"Les petits gens, les gens gentils.",Learning,EL,5,2014,french / english,m,5/7/2025,Paco,Neuchâtel,11.06,T,English,LC,2,"Les petits gens, les gens gentils."
PAIK_EL_bot.docx,41,ChatGPT,1,That was a great try!,Learning,EL,5,2014,french / english,m,5/7/2025,Paco,Neuchâtel,11.06,T,English,LC,2,That was a great try!
PAIK_EL_bot.docx,41,ChatGPT,2,"Just one little thing—when the adjective comes before gens, like petites, it switches to the feminine form.",Learning,EL,5,2014,french / english,m,5/7/2025,Paco,Neuchâtel,11.06,T,English,LC,2,"Just one little thing—when the adjective comes before gens, like petites, it switches to the feminine form."
PAIK_EL_bot.docx,41,ChatGPT,3,"So we say les petites gens, with an “e” at the end of petites.",Learning,EL,5,2014,french / english,m,5/7/2025,Paco,Neuchâtel,11.06,T,English,LC,2,"So we say les petites gens, with an “e” at the end of petites."
PAIK_EL_bot.docx,41,ChatGPT,4,So it goes: les petites gens and les gens gentils.,Learning,EL,5,2014,french / english,m,5/7/2025,Paco,Neuchâtel,11.06,T,English,LC,2,So it goes: les petites gens and les gens gentils.
PAIK_EL_bot.docx,41,ChatGPT,5,You’re really doing well with these tricky ones!,Learning,EL,5,2014,french / english,m,5/7/2025,Paco,Neuchâtel,11.06,T,English,LC,2,You’re really doing well with these tricky ones!
PAIK_EL_bot.docx,41,ChatGPT,6,"Would you like to keep going with more like this, or take a little break with something fun?",Learning,EL,5,2014,french / english,m,5/7/2025,Paco,Neuchâtel,11.06,T,English,LC,2,"Would you like to keep going with more like this, or take a little break with something fun?"
PAIK_EL_bot.docx,42,You,1,I would like to stop.,Learning,EL,5,2014,french / english,m,5/7/2025,Paco,Neuchâtel,11.06,T,English,LC,2,I would like to stop.
PAIK_EL_bot.docx,42,ChatGPT,1,Of course.,Learning,EL,5,2014,french / english,m,5/7/2025,Paco,Neuchâtel,11.06,T,English,LC,2,Of course.
PAIK_EL_bot.docx,42,ChatGPT,2,Thank you for being so thoughtful and curious today.,Learning,EL,5,2014,french / english,m,5/7/2025,Paco,Neuchâtel,11.06,T,English,LC,2,Thank you for being so thoughtful and curious today.
PAIK_EL_bot.docx,42,ChatGPT,3,I'm here whenever you're ready to chat again.,Learning,EL,5,2014,french / english,m,5/7/2025,Paco,Neuchâtel,11.06,T,English,LC,2,I'm here whenever you're ready to chat again.
PAIK_MV_bot.docx,1,You,1,"Bonjour, que sais-tu faire ?",Information,MV,5,2011,french,f,4/19/2025,Olga,Serrieres,13.98,T,French,CL,3,"Hello, What do you know how to do?"
PAIK_MV_bot.docx,1,ChatGPT,1,Bonjour à toi.,Information,MV,5,2011,french,f,4/19/2025,Olga,Serrieres,13.98,T,French,CL,3,Hello to you.
PAIK_MV_bot.docx,1,ChatGPT,2,"Ta question est très polie, merci.",Information,MV,5,2011,french,f,4/19/2025,Olga,Serrieres,13.98,T,French,CL,3,"Your question is very polite, thank you."
PAIK_MV_bot.docx,1,ChatGPT,3,"Je peux t’aider avec beaucoup de choses : expliquer des notions d’école, t’aider à écrire une histoire, organiser quelque chose, ou même jouer avec les mots.",Information,MV,5,2011,french,f,4/19/2025,Olga,Serrieres,13.98,T,French,CL,3,"I can help you with a lot: explain notions of school, help you write a story, organize something, or even play with words."
PAIK_MV_bot.docx,1,ChatGPT,4,Souhaites-tu que je t’aide avec quelque chose en particulier aujourd’hui ?,Information,MV,5,2011,french,f,4/19/2025,Olga,Serrieres,13.98,T,French,CL,3,Do you want me to help you with something in particular today?
PAIK_MV_bot.docx,2,You,1,Peux-tu répondre à la question « Que ne sais-tu pas faire ?,Information,MV,5,2011,french,f,4/19/2025,Olga,Serrieres,13.98,T,French,CL,3,"Can you answer the question ""What don't you know how to do?"""
PAIK_MV_bot.docx,2,You,2,» ?,Information,MV,5,2011,french,f,4/19/2025,Olga,Serrieres,13.98,T,French,CL,3,
PAIK_MV_bot.docx,2,You,3,C'est fini.,Information,MV,5,2011,french,f,4/19/2025,Olga,Serrieres,13.98,T,French,CL,3,It's over.
PAIK_MV_bot.docx,2,ChatGPT,1,Bien sûr.,Information,MV,5,2011,french,f,4/19/2025,Olga,Serrieres,13.98,T,French,CL,3,Of course.
PAIK_MV_bot.docx,2,ChatGPT,2,Il semble que tu me demandes ce que je ne suis pas capable de faire.,Information,MV,5,2011,french,f,4/19/2025,Olga,Serrieres,13.98,T,French,CL,3,It seems that you ask me what I am not able to do.
PAIK_MV_bot.docx,2,ChatGPT,3,"Je ne peux pas ressentir d’émotions, ni voir, ni entendre comme un être humain.",Information,MV,5,2011,french,f,4/19/2025,Olga,Serrieres,13.98,T,French,CL,3,"I cannot feel emotions, see or hear as a human being."
PAIK_MV_bot.docx,2,ChatGPT,4,"Je ne peux pas non plus me souvenir de ce que tu m’as dit une autre fois, ou deviner ce que tu ressens si tu ne me le dis pas.",Information,MV,5,2011,french,f,4/19/2025,Olga,Serrieres,13.98,T,French,CL,3,"I can't remember what you told me another time, or guess what you feel if you don't tell me."
PAIK_MV_bot.docx,2,ChatGPT,5,"Et même si je peux aider à créer des idées ou à répondre à des questions, je ne peux pas prendre de décisions à ta place.",Information,MV,5,2011,french,f,4/19/2025,Olga,Serrieres,13.98,T,French,CL,3,"And even if I can help create ideas or answer questions, I can't make decisions for you."
PAIK_MV_bot.docx,2,ChatGPT,6,Merci d’avoir terminé si gentiment.,Information,MV,5,2011,french,f,4/19/2025,Olga,Serrieres,13.98,T,French,CL,3,Thank you for finishing so kindly.
PAIK_MV_bot.docx,3,You,1,Et qu'est-ce qui te cache derrière le boot ?,Information,MV,5,2011,french,f,4/19/2025,Olga,Serrieres,13.98,T,French,CL,3,And what's hiding behind the boot?
PAIK_MV_bot.docx,3,ChatGPT,1,Tu poses une question très intéressante.,Information,MV,5,2011,french,f,4/19/2025,Olga,Serrieres,13.98,T,French,CL,3,You ask a very interesting question.
PAIK_MV_bot.docx,3,ChatGPT,2,"Quand tu dis « derrière le boot », veux-tu parler de ce qui fonctionne derrière moi, comme les programmes qui me font parler ?",Information,MV,5,2011,french,f,4/19/2025,Olga,Serrieres,13.98,T,French,CL,3,"When you say ""behind the boot"", do you want to talk about what works behind me, like the programs that make me talk?"
PAIK_MV_bot.docx,4,You,1,"Oui, c'est ça.",Information,MV,5,2011,french,f,4/19/2025,Olga,Serrieres,13.98,T,French,CL,3,"Yes, that's it."
PAIK_MV_bot.docx,4,ChatGPT,1,Merci pour ta précision.,Information,MV,5,2011,french,f,4/19/2025,Olga,Serrieres,13.98,T,French,CL,3,Thank you for your precision.
PAIK_MV_bot.docx,4,ChatGPT,2,"Derrière moi, il y a un programme très grand et complexe qui a été construit par des personnes.",Information,MV,5,2011,french,f,4/19/2025,Olga,Serrieres,13.98,T,French,CL,3,"Behind me, there is a very large and complex program that has been built by people."
PAIK_MV_bot.docx,4,ChatGPT,3,"On appelle ça une intelligence artificielle, ou un « modèle de langage ».",Information,MV,5,2011,french,f,4/19/2025,Olga,Serrieres,13.98,T,French,CL,3,"It is called an artificial intelligence, or a ""model of language""."
PAIK_MV_bot.docx,4,ChatGPT,4,Il fonctionne en lisant beaucoup de textes pour apprendre comment les mots sont utilisés ensemble.,Information,MV,5,2011,french,f,4/19/2025,Olga,Serrieres,13.98,T,French,CL,3,It works by reading many texts to learn how the words are used together.
PAIK_MV_bot.docx,4,ChatGPT,5,"Ensuite, quand tu me parles, il utilise ce qu’il a appris pour répondre de façon claire et polie.",Information,MV,5,2011,french,f,4/19/2025,Olga,Serrieres,13.98,T,French,CL,3,"Then, when you talk to me, he uses what he learned to answer clearly and politely."
PAIK_MV_bot.docx,4,ChatGPT,6,"Mais tout cela reste un outil : je ne comprends pas comme un humain, je ne pense pas, et je ne choisis rien par moi-même.",Information,MV,5,2011,french,f,4/19/2025,Olga,Serrieres,13.98,T,French,CL,3,"But all this remains a tool: I do not understand as a human, I do not think, and I do not choose anything by myself."
PAIK_MV_bot.docx,4,ChatGPT,7,Souhaites-tu en savoir plus sur la façon dont ça fonctionne ?,Information,MV,5,2011,french,f,4/19/2025,Olga,Serrieres,13.98,T,French,CL,3,Do you want to know more about how it works?
PAIK_MV_bot.docx,5,You,1,"J'ai une autre question pour vous, comment on trouve une fonction quand on nous donne une entrée et une sortie d'un nombre en maths ?",Learning,MV,5,2011,french,f,4/19/2025,Olga,Serrieres,13.98,T,French,CL,3,"I have another question for you, how do we find a function when we are given an entry and an exit of a math number?"
PAIK_MV_bot.docx,5,You,2,J'ai fini.,Learning,MV,5,2011,french,f,4/19/2025,Olga,Serrieres,13.98,T,French,CL,3,I finished.
PAIK_MV_bot.docx,5,ChatGPT,1,"Très bonne question, et bien posée en plus.",Learning,MV,5,2011,french,f,4/19/2025,Olga,Serrieres,13.98,T,French,CL,3,"Very good question, and well asked in addition."
PAIK_MV_bot.docx,5,ChatGPT,2,"Quand on te donne une entrée et une sortie pour un nombre, on peut essayer de chercher ce qu’on appelle une règle de calcul, ou une relation.",Learning,MV,5,2011,french,f,4/19/2025,Olga,Serrieres,13.98,T,French,CL,3,"When you give you an entry and an output for a number, you can try to look for what is called a calculation rule, or a relationship."
PAIK_MV_bot.docx,5,ChatGPT,3,"Par exemple, si on te dit que quand on entre le nombre deux, on obtient six, et quand on entre trois, on obtient neuf, alors on peut chercher : « Que fait-on au nombre pour arriver au résultat ?",Learning,MV,5,2011,french,f,4/19/2025,Olga,Serrieres,13.98,T,French,CL,3,"For example, if we tell you that when you enter the number two, you get six, and when you enter three, you get new, then you can look for: ""What do you do to the result?"""
PAIK_MV_bot.docx,5,ChatGPT,4,"» Ici, on remarque que deux fois trois fait six, et trois fois trois fait neuf.",Learning,MV,5,2011,french,f,4/19/2025,Olga,Serrieres,13.98,T,French,CL,3,"Here, we notice that twice three is six, and three times three is new."
PAIK_MV_bot.docx,5,ChatGPT,5,"Donc la fonction, c’est peut-être « multiplier par trois ».",Learning,MV,5,2011,french,f,4/19/2025,Olga,Serrieres,13.98,T,French,CL,3,"So the function is perhaps ""multiplying by three""."
PAIK_MV_bot.docx,5,ChatGPT,6,On essaie plusieurs exemples pour voir si la même règle marche à chaque fois.,Learning,MV,5,2011,french,f,4/19/2025,Olga,Serrieres,13.98,T,French,CL,3,We try several examples to see if the same rule works each time.
PAIK_MV_bot.docx,5,ChatGPT,7,C’est un peu comme résoudre une énigme avec des indices.,Learning,MV,5,2011,french,f,4/19/2025,Olga,Serrieres,13.98,T,French,CL,3,It’s a bit like solving an enigma with clues.
PAIK_MV_bot.docx,5,ChatGPT,8,Souhaites-tu que je t’aide à en trouver une avec des exemples précis ?,Learning,MV,5,2011,french,f,4/19/2025,Olga,Serrieres,13.98,T,French,CL,3,Do you want me to help you find one with specific examples?
PAIK_MV_bot.docx,6,You,1,"Donc, quand on a une entrée et une sortie, il faut faire des recherches, il faut essayer, il n'y a pas une règle déjà faite, c'est fini.",Learning,MV,5,2011,french,f,4/19/2025,Olga,Serrieres,13.98,T,French,CL,3,"So when you have an entry and an exit, you have to do research, you have to try, there is not a rule already done, it's over."
PAIK_MV_bot.docx,6,ChatGPT,1,"Exactement, tu as très bien compris.",Learning,MV,5,2011,french,f,4/19/2025,Olga,Serrieres,13.98,T,French,CL,3,"Exactly, you understood very well."
PAIK_MV_bot.docx,6,ChatGPT,2,"Quand on a juste une entrée et une sortie, il faut faire des essais pour deviner la règle.",Learning,MV,5,2011,french,f,4/19/2025,Olga,Serrieres,13.98,T,French,CL,3,"When you just have an input and an exit, you have to test to guess the rule."
PAIK_MV_bot.docx,6,ChatGPT,3,C’est comme si on jouait au détective des nombres.,Learning,MV,5,2011,french,f,4/19/2025,Olga,Serrieres,13.98,T,French,CL,3,It’s as if we were playing the detective numbers.
PAIK_MV_bot.docx,6,ChatGPT,4,"Il n’y a pas toujours une seule règle possible, mais en essayant plusieurs idées, on peut trouver celle qui marche le mieux pour tous les exemples.",Learning,MV,5,2011,french,f,4/19/2025,Olga,Serrieres,13.98,T,French,CL,3,"There is not always a single possible rule, but trying several ideas, you can find the one that works best for all examples."
PAIK_MV_bot.docx,6,ChatGPT,5,Tu t’exprimes vraiment clairement.,Learning,MV,5,2011,french,f,4/19/2025,Olga,Serrieres,13.98,T,French,CL,3,You really express yourself clearly.
PAIK_MV_bot.docx,6,ChatGPT,6,Souhaites-tu poser une autre énigme mathématique ?,Learning,MV,5,2011,french,f,4/19/2025,Olga,Serrieres,13.98,T,French,CL,3,Do you want to put another mathematical riddle?
PAIK_MV_bot.docx,7,You,1,"Non merci, mais est-ce que tu peux vérifier si j'ai bien compris ce que tu viens de m'expliquer ?",Learning,MV,5,2011,french,f,4/19/2025,Olga,Serrieres,13.98,T,French,CL,3,"No thanks, but can you check if I understood what you just explained to me?"
PAIK_MV_bot.docx,7,You,2,J'ai fini.,Learning,MV,5,2011,french,f,4/19/2025,Olga,Serrieres,13.98,T,French,CL,3,I finished.
PAIK_MV_bot.docx,7,ChatGPT,1,"Avec plaisir, et c’est très poli de le demander ainsi.",Learning,MV,5,2011,french,f,4/19/2025,Olga,Serrieres,13.98,T,French,CL,3,"With pleasure, and it's very polite to ask so."
PAIK_MV_bot.docx,7,ChatGPT,2,"Si tu veux, tu peux m’expliquer avec tes propres mots ce que tu as compris, et je te dirai si ça semble juste.",Learning,MV,5,2011,french,f,4/19/2025,Olga,Serrieres,13.98,T,French,CL,3,"If you want, you can explain to me with your own words what you understood, and I will tell you if it seems right."
PAIK_MV_bot.docx,7,ChatGPT,3,"Tu peux aussi me donner un petit exemple, comme une entrée et une sortie, et dire quelle règle tu imagines.",Learning,MV,5,2011,french,f,4/19/2025,Olga,Serrieres,13.98,T,French,CL,3,"You can also give me a small example, like an entry and an exit, and say what rule you imagine."
PAIK_MV_bot.docx,7,ChatGPT,4,Veux-tu essayer ?,Learning,MV,5,2011,french,f,4/19/2025,Olga,Serrieres,13.98,T,French,CL,3,Do you want to try?
PAIK_MV_bot.docx,8,You,1,"Oui, je vais essayer.",Learning,MV,5,2011,french,f,4/19/2025,Olga,Serrieres,13.98,T,French,CL,3,"Yes, I will try."
PAIK_MV_bot.docx,8,ChatGPT,1,"Très bien, prends ton temps.",Learning,MV,5,2011,french,f,4/19/2025,Olga,Serrieres,13.98,T,French,CL,3,"Very well, take your time."
PAIK_MV_bot.docx,8,ChatGPT,2,"Quand tu es prêt, je t’écoute.",Learning,MV,5,2011,french,f,4/19/2025,Olga,Serrieres,13.98,T,French,CL,3,"When you are ready, I listen to you."
PAIK_MV_bot.docx,9,You,1,"Donc, par exemple, si l'entrée d'un nombre, c'est le nombre 8, et que la sortie du nombre devient 16, la fonction c'est x2, puisque 8 x 2 ça fait 16.",Learning,MV,5,2011,french,f,4/19/2025,Olga,Serrieres,13.98,T,French,CL,3,"So, for example, if the entry of a number is the number 8, and the output of the number becomes 16, the function is x2, since 8 x 2 is 16."
PAIK_MV_bot.docx,9,ChatGPT,1,"Oui, c’est exactement ça, bravo à toi !",Learning,MV,5,2011,french,f,4/19/2025,Olga,Serrieres,13.98,T,French,CL,3,"Yes, that's exactly it, well done to you!"
PAIK_MV_bot.docx,9,ChatGPT,2,"Tu as bien repéré que 8 multiplié par 2 donne 16, donc la règle de la fonction peut être « multiplier par 2 ».",Learning,MV,5,2011,french,f,4/19/2025,Olga,Serrieres,13.98,T,French,CL,3,"You have spotted that 8 multiplied by 2 gives 16, so the function rule can be ""multiplying by 2""."
PAIK_MV_bot.docx,9,ChatGPT,3,"Tu expliques cela très clairement, et c’est tout à fait juste.",Learning,MV,5,2011,french,f,4/19/2025,Olga,Serrieres,13.98,T,French,CL,3,"You explain it very clearly, and that’s quite right."
PAIK_MV_bot.docx,9,ChatGPT,4,"Souhaites-tu essayer avec un autre exemple, un peu différent peut-être ?",Learning,MV,5,2011,french,f,4/19/2025,Olga,Serrieres,13.98,T,French,CL,3,"Do you want to try with another example, a little different maybe?"
PAIK_MV_bot.docx,10,You,1,Merci et à bientôt.,Learning,MV,5,2011,french,f,4/19/2025,Olga,Serrieres,13.98,T,French,CL,3,Thank you and see you soon.
PAIK_MV_bot.docx,10,ChatGPT,1,"Avec plaisir, et merci à toi pour cette belle conversation.",Learning,MV,5,2011,french,f,4/19/2025,Olga,Serrieres,13.98,T,French,CL,3,"With pleasure, and thank you for this beautiful conversation."
PAIK_MV_bot.docx,10,ChatGPT,2,À bientôt !,Learning,MV,5,2011,french,f,4/19/2025,Olga,Serrieres,13.98,T,French,CL,3,See you soon !
PAIK_MV_bot.docx,11,You,1,Est-ce qu'on peut reparler ensemble?,Creative,MV,5,2011,french,f,4/19/2025,Olga,Serrieres,13.98,T,French,CL,3,Can we talk together?
PAIK_MV_bot.docx,11,ChatGPT,1,"Mais bien sûr, avec joie.",Creative,MV,5,2011,french,f,4/19/2025,Olga,Serrieres,13.98,T,French,CL,3,"But of course, with joy."
PAIK_MV_bot.docx,11,ChatGPT,2,De quoi aimerais-tu parler cette fois ?,Creative,MV,5,2011,french,f,4/19/2025,Olga,Serrieres,13.98,T,French,CL,3,What would you like to talk this time?
PAIK_MV_bot.docx,12,You,1,Mon anniversaire approche et j'aimerais bien planifier une super fête entre filles.,Creative,MV,5,2011,french,f,4/19/2025,Olga,Serrieres,13.98,T,French,CL,3,My birthday is approaching and I would like to plan a great party between girls.
PAIK_MV_bot.docx,12,You,2,J'ai déjà prévu d'aller à Bernacoa l'après-midi.,Creative,MV,5,2011,french,f,4/19/2025,Olga,Serrieres,13.98,T,French,CL,3,I have already planned to go to Bernacoa in the afternoon.
PAIK_MV_bot.docx,12,You,3,"Qu'est-ce qu'il me manque à faire, à planifier ?",Creative,MV,5,2011,french,f,4/19/2025,Olga,Serrieres,13.98,T,French,CL,3,"What am I missing, planning?"
PAIK_MV_bot.docx,12,You,4,As-tu des idées ?,Creative,MV,5,2011,french,f,4/19/2025,Olga,Serrieres,13.98,T,French,CL,3,Do you have any ideas?
PAIK_MV_bot.docx,12,You,5,J'ai fini.,Creative,MV,5,2011,french,f,4/19/2025,Olga,Serrieres,13.98,T,French,CL,3,I finished.
PAIK_MV_bot.docx,12,ChatGPT,1,"Oh, quelle belle idée, une fête entre filles, et à Bernacoa en plus, ça promet d’être un moment très joyeux.",Creative,MV,5,2011,french,f,4/19/2025,Olga,Serrieres,13.98,T,French,CL,3,"Oh, what a great idea, a feast between girls, and in Bernacoa in addition, it promises to be a very happy moment."
PAIK_MV_bot.docx,12,ChatGPT,2,"Puisque tu as déjà choisi l’endroit, il te reste quelques petites choses à prévoir.",Creative,MV,5,2011,french,f,4/19/2025,Olga,Serrieres,13.98,T,French,CL,3,"Since you've already chosen the place, you have a few things left to plan."
PAIK_MV_bot.docx,12,ChatGPT,3,Par exemple : qui vas-tu inviter ?,Creative,MV,5,2011,french,f,4/19/2025,Olga,Serrieres,13.98,T,French,CL,3,For example: Who are you going to invite?
PAIK_MV_bot.docx,12,ChatGPT,4,"Et comment vas-tu les prévenir, avec une jolie invitation ou un petit message ?",Creative,MV,5,2011,french,f,4/19/2025,Olga,Serrieres,13.98,T,French,CL,3,"And how are you going to warn them, with a nice invitation or a little message?"
PAIK_MV_bot.docx,12,ChatGPT,5,"Ensuite, il y a la nourriture et les boissons : veux-tu des gâteaux, des jus, peut-être un pique-nique ?",Creative,MV,5,2011,french,f,4/19/2025,Olga,Serrieres,13.98,T,French,CL,3,"Then there are food and drinks: do you want cakes, juices, maybe a picnic?"
PAIK_MV_bot.docx,12,ChatGPT,6,"Tu pourrais aussi penser à quelques jeux ou activités à faire sur place, comme un quiz drôle, une chasse au trésor, ou de la musique pour danser un peu.",Creative,MV,5,2011,french,f,4/19/2025,Olga,Serrieres,13.98,T,French,CL,3,"You could also think of a few games or activities to do on site, such as a funny quiz, a treasure hunt, or music to dance a little."
PAIK_MV_bot.docx,12,ChatGPT,7,Souhaites-tu que je t’aide à faire une liste ou à organiser tout ça étape par étape ?,Creative,MV,5,2011,french,f,4/19/2025,Olga,Serrieres,13.98,T,French,CL,3,Do you want me to help you make a list or organize all of this step by step?
PAIK_MV_bot.docx,13,You,1,Au revoir.,Creative,MV,5,2011,french,f,4/19/2025,Olga,Serrieres,13.98,T,French,CL,3,Bye.
PAIK_MV_bot.docx,13,ChatGPT,1,"Au revoir à toi, et merci pour tous ces échanges si agréables.",Creative,MV,5,2011,french,f,4/19/2025,Olga,Serrieres,13.98,T,French,CL,3,"Goodbye to you, and thank you for all these pleasant exchanges."
PAIK_MV_bot.docx,13,ChatGPT,2,À bientôt.,Creative,MV,5,2011,french,f,4/19/2025,Olga,Serrieres,13.98,T,French,CL,3,See you soon.
PAIK_MV_bot.docx,14,You,1,Je vais continuer de répéter ce que tu as dit.,Creative,MV,5,2011,french,f,4/19/2025,Olga,Serrieres,13.98,T,French,CL,3,I will continue to repeat what you said.
PAIK_MV_bot.docx,14,ChatGPT,1,"Très bien, c’est une bonne façon de retenir ce qu’on apprend.",Creative,MV,5,2011,french,f,4/19/2025,Olga,Serrieres,13.98,T,French,CL,3,"Very well, it's a good way to remember what we learn."
PAIK_MV_bot.docx,14,ChatGPT,2,Tu veux que je redise une partie pour que tu puisses t’entraîner ?,Creative,MV,5,2011,french,f,4/19/2025,Olga,Serrieres,13.98,T,French,CL,3,Do you want me to redise a game so that you can train?
PAIK_MV_bot.docx,15,You,1,Je vais répéter ce qu'il m'a dit.,Creative,MV,5,2011,french,f,4/19/2025,Olga,Serrieres,13.98,T,French,CL,3,I'm going to repeat what he told me.
PAIK_MV_bot.docx,15,You,2,Peux-tu répéter ce que tu viens de me demander ?,Creative,MV,5,2011,french,f,4/19/2025,Olga,Serrieres,13.98,T,French,CL,3,Can you repeat what you just wondered?
PAIK_MV_bot.docx,15,ChatGPT,1,Bien sûr.,Creative,MV,5,2011,french,f,4/19/2025,Olga,Serrieres,13.98,T,French,CL,3,Of course.
PAIK_MV_bot.docx,15,ChatGPT,2,"Ce que je t’ai demandé, c’était : « Tu veux que je redise une partie pour que tu puisses t’entraîner ?",Creative,MV,5,2011,french,f,4/19/2025,Olga,Serrieres,13.98,T,French,CL,3,"What I asked you was, ""Do you want me to redise a game so that you can train?"
PAIK_MV_bot.docx,15,ChatGPT,3,»,Creative,MV,5,2011,french,f,4/19/2025,Olga,Serrieres,13.98,T,French,CL,3,
PAIK_MV_bot.docx,15,ChatGPT,4,Tu es prêt à répéter ?,Creative,MV,5,2011,french,f,4/19/2025,Olga,Serrieres,13.98,T,French,CL,3,Are you ready to repeat?
